### ISSUE TITLE
Remote don't use correct api

### ISSUE THREAD

**Issue by ThomasZumsteg** [OpenSprinkler/OpenSprinkler-Firmware#45]
Master:
  Firmware 2.1.7 
  OpenSprinker2 (Arduino)
  IP: 192.168.1.14
  Hostname: OS-DH

Remote:
  Firmware 2.1.7
  OpenSprinkler Pi (Raspberry Pi 3)
  IP 192.168.1.64

To reproduce:
1) Add stations as appropriate
1) Configure Remote as extender
1) Run remote station from master webui
1) Stop remote station from master webui

```
$ sudo tcpdump -i wlan0 -v 'host 192.168.1.14 and port 8080'

05:36:31.380865 IP (tos 0x0, ttl 64, id 0, offset 0, flags [DF], proto TCP (6), length 140)
    OS-DH.2841 > 192.168.1.64.http-alt: Flags [P.], cksum 0xfa53 (correct), seq 1:101, ack 1, win 1024, length 100: HTTP, length: 100
        GET /cm?pw=a6d82bced638de3def1e9bbb4983225c&sid=2&en=1&t=-1 HTTP/1.0
        Host: *
        Accept: text/html

05:36:31.380913 IP (tos 0x0, ttl 64, id 14133, offset 0, flags [DF], proto TCP (6), length 40)
    192.168.1.64.http-alt > OS-DH.2841: Flags [.], cksum 0x0c32 (correct), ack 101, win 29200, length 0
05:36:31.381092 IP (tos 0x0, ttl 64, id 14134, offset 0, flags [DF], proto TCP (6), length 57)
    192.168.1.64.http-alt > OS-DH.2841: Flags [P.], cksum 0x4c53 (correct), seq 1:18, ack 101, win 29200, length 17: HTTP, length: 17
        HTTP/1.1 200 OK
05:36:31.381241 IP (tos 0x0, ttl 64, id 14135, offset 0, flags [DF], proto TCP (6), length 201)
    192.168.1.64.http-alt > OS-DH.2841: Flags [FP.], cksum 0x85b6 (correct), seq 18:179, ack 101, win 29200, length 161: HTTP
05:36:31.389998 IP (tos 0x0, ttl 64, id 14134, offset 0, flags [DF], proto TCP (6), length 40)
    OS-DH.2841 > 192.168.1.64.http-alt: Flags [FP.], cksum 0x7a28 (correct), seq 101, ack 18, win 1024, length 0
05:36:31.390041 IP (tos 0x0, ttl 64, id 14136, offset 0, flags [DF], proto TCP (6), length 40)
    192.168.1.64.http-alt > OS-DH.2841: Flags [.], cksum 0x0b7e (correct), ack 102, win 29200, length 0
05:36:31.399637 IP (tos 0x0, ttl 64, id 14135, offset 0, flags [DF], proto TCP (6), length 40)
    OS-DH.2841 > 192.168.1.64.http-alt: Flags [FP.], cksum 0x7986 (correct), seq 101, ack 180, win 1024, length 0
05:37:00.227596 IP (tos 0x0, ttl 63, id 0, offset 0, flags [DF], proto TCP (6), length 44)
    OS-DH.2874 > 192.168.1.64.http-alt: Flags [S], cksum 0xc94b (correct), seq 8448, win 768, options [mss 550], length 0
05:37:00.227686 IP (tos 0x0, ttl 64, id 0, offset 0, flags [DF], proto TCP (6), length 44)
    192.168.1.64.http-alt > OS-DH.2874: Flags [S.], cksum 0x9ae4 (correct), seq 2359439125, ack 8449, win 29200, options [mss 1460], length 0
05:37:00.292967 IP (tos 0x0, ttl 63, id 0, offset 0, flags [DF], proto TCP (6), length 217)
    OS-DH.2874 > 192.168.1.64.http-alt: Flags [F.], cksum 0x47ac (correct), seq 4294966529:4294966702, ack 1935528171, win 768, options [[bad opt]
05:37:00.293007 IP (tos 0x0, ttl 64, id 62545, offset 0, flags [DF], proto TCP (6), length 40)
    192.168.1.64.http-alt > OS-DH.2874: Flags [R], cksum 0x0178 (correct), seq 0, win 0, length 0
05:37:00.293111 IP (tos 0x0, ttl 64, id 0, offset 0, flags [DF], proto TCP (6), length 40)
    OS-DH.2874 > 192.168.1.64.http-alt: Flags [.], cksum 0x20b2 (correct), ack 1, win 1024, length 0
05:37:00.293270 IP (tos 0x0, ttl 64, id 0, offset 0, flags [DF], proto TCP (6), length 95)
    OS-DH.2874 > 192.168.1.64.http-alt: Flags [P.], cksum 0xca86 (correct), seq 1:56, ack 1, win 1024, length 55: HTTP, length: 55
        GET /cm2619]
         HTTP/1.0
        Host: *
        Accept: text/html

05:37:00.293306 IP (tos 0x0, ttl 64, id 252, offset 0, flags [DF], proto TCP (6), length 40)
    192.168.1.64.http-alt > OS-DH.2874: Flags [.], cksum 0xb26a (correct), ack 56, win 29200, length 0
05:37:00.293460 IP (tos 0x0, ttl 64, id 253, offset 0, flags [DF], proto TCP (6), length 57)
    192.168.1.64.http-alt > OS-DH.2874: Flags [P.], cksum 0xf28b (correct), seq 1:18, ack 56, win 29200, length 17: HTTP, length: 17
        HTTP/1.1 200 OK
05:37:00.293644 IP (tos 0x0, ttl 64, id 254, offset 0, flags [DF], proto TCP (6), length 201)
    192.168.1.64.http-alt > OS-DH.2874: Flags [FP.], cksum 0x2bf0 (correct), seq 18:179, ack 56, win 29200, length 161: HTTP
05:37:00.563981 IP (tos 0x0, ttl 64, id 255, offset 0, flags [DF], proto TCP (6), length 218)
    192.168.1.64.http-alt > OS-DH.2874: Flags [FP.], cksum 0x3264 (correct), seq 1:179, ack 56, win 29200, length 178: HTTP, length: 178
        HTTP/1.1 200 OK
        Content-Type: application/json
        Connection: close
        Cache-Control: max-age=0, no-cache, no-store, must-revalidate
        Access-Control-Allow-Origin: *

        {"result":16}[!http]
05:37:01.113975 IP (tos 0x0, ttl 64, id 256, offset 0, flags [DF], proto TCP (6), length 218)
    192.168.1.64.http-alt > OS-DH.2874: Flags [FP.], cksum 0x3264 (correct), seq 1:179, ack 56, win 29200, length 178: HTTP, length: 178
        HTTP/1.1 200 OK
        Content-Type: application/json
        Connection: close
        Cache-Control: max-age=0, no-cache, no-store, must-revalidate
        Access-Control-Allow-Origin: *

        {"result":16}[!http]
```

**Comment by rayshobby** [comment]
This issue was reported for an earlier version of the firmware. I am closing it now -- if it still exists for the current version of firmware, feel free to re-open it.
